{"base_branch": "hailmary_deploy", "branch_scope": "auto_main", "change_summary": "on the first GPS publish for a waypoint leg, dispatch NavigateToPose but do not also publish the same pose to /goal_update until later ticks", "conclusion": "Discarded: removing the same-cycle first /goal_update did not improve the handoff. Both lanes timed out before waypoint 1; planning_control reached 29.404m but with worse clearance, and planning_control_ros22 regressed to 15.76m with very high GradientEscape/stuck counts.", "courses": ["blender_competition_course"], "diff_path": "/Users/cole/code/git/autonav_sim/igvc_competition_sim/autoresearch/results/patches/20260601_075830_remove-the-same-cycle-first-gps-goal-update.patch", "diff_sha256": "87d2fc260fd459d83908f60dcbb44878fb2fe7e77925f3132a64e8e9126bf411", "diff_stat": ".../gps_waypoint_handler/gps_waypoint_handler/gps_handler_node.py   | 6 +++---\n 1 file changed, 3 insertions(+), 3 deletions(-)", "files_changed": ["isaac_ros-dev/src/gps_waypoint_handler/gps_waypoint_handler/gps_handler_node.py"], "hypothesis": "Remove the same-cycle first GPS goal_update publish so the direct NavigateToPose action alone seeds each new waypoint leg", "id": "20260601_075830_remove-the-same-cycle-first-gps-goal-update", "normalized_hypothesis": "remove the same cycle first gps goal update publish so the direct navigatetopose action alone seeds each new waypoint leg", "notes": "valid direct evaluate.py runs with timeout 360: planning_control /home/cole.guest/autonav_split_ws/src/autonav_sim/igvc_competition_sim/autoresearch/results/runs/blender_competition_course_20260601_075120_run1; planning_control_ros22 /home/cole.guest/autonav_jetson_sim_ws/src/autonav_sim/igvc_competition_sim/autoresearch/results/runs/blender_competition_course_20260601_075119_run1", "result": {"planning_control_ang_var": "0.23055", "planning_control_distance": "29.404", "planning_control_ge": "64", "planning_control_min_clear": "-0.541", "planning_control_mission_status": "124", "planning_control_progress": "69.404", "planning_control_rev": "73", "planning_control_ros22_ang_var": "0.1899", "planning_control_ros22_distance": "15.76", "planning_control_ros22_ge": "133", "planning_control_ros22_min_clear": "-0.36", "planning_control_ros22_mission_status": "124", "planning_control_ros22_progress": "55.76", "planning_control_ros22_rev": "42", "planning_control_ros22_stuck": "133", "planning_control_stuck": "112"}, "retry_rule": "Keep the current first direct action plus /goal_update behavior. Do not retry first-tick /goal_update suppression alone on Blender.", "robot_branch": "auto_main", "robot_commit": "82dffc050e6d", "sim_commit": "a2a512a00e69", "status": "discarded", "tier": 1, "time": "2026-06-01T07:58:30"}
{"base_branch": "hailmary_deploy", "branch_scope": "auto_main", "change_summary": "on top of full Smac lattice plus 1m arrival and critic balance, publish /local_mirror_layer/clear at each GPS waypoint and set line/local-mirror clear_radius to 0.85m", "conclusion": "Promising but not yet terminal: the waypoint-clear addition made planning_control complete cleanly and improved planning_control_ros22 final-return progress versus the same full-route stack at timeout 360, with no scorer line/contact violations. Needs repeat evidence because the prior route stack also had a one-off clean Gazebo pass.", "courses": ["blender_competition_course"], "diff_path": "/Users/cole/code/git/autonav_sim/igvc_competition_sim/autoresearch/results/patches/20260601_080842_add-a-footprint-sized-local-mirror-and-line.patch", "diff_sha256": "7948c8e8e6ff5d01ecd32f1699af5643c2918a2120ad05ff2372a1840b5c96e9", "diff_stat": ".../gps_waypoint_handler/gps_handler_node.py       |  8 ++-\n isaac_ros-dev/src/slam/config/nav2_paramsv2.yaml   | 63 +++++++++++-----------\n 2 files changed, 38 insertions(+), 33 deletions(-)", "files_changed": ["isaac_ros-dev/src/gps_waypoint_handler/gps_waypoint_handler/gps_handler_node.py", "isaac_ros-dev/src/slam/config/nav2_paramsv2.yaml"], "hypothesis": "Add a footprint-sized local mirror and line memory clear at each GPS waypoint handoff on the prior full-route stack to remove lethal-start stalls on later legs", "id": "20260601_080842_add-a-footprint-sized-local-mirror-and-line", "normalized_hypothesis": "add a footprint sized local mirror and line memory clear at each gps waypoint handoff on the prior full route stack to remove lethal start stalls on later legs", "notes": "valid direct evaluate.py runs with timeout 360: planning_control /home/cole.guest/autonav_split_ws/src/autonav_sim/igvc_competition_sim/autoresearch/results/runs/blender_competition_course_20260601_080127_run1; planning_control_ros22 /home/cole.guest/autonav_jetson_sim_ws/src/autonav_sim/igvc_competition_sim/autoresearch/results/runs/blender_competition_course_20260601_080127_run1", "result": {"planning_control_ang_var": "0.29455", "planning_control_distance": "110.337", "planning_control_ge": "4", "planning_control_min_clear": "-0.728", "planning_control_mission_status": "0", "planning_control_pass": "1", "planning_control_progress": "160.337", "planning_control_rev": "270", "planning_control_ros22_ang_var": "0.3384", "planning_control_ros22_distance": "108.126", "planning_control_ros22_ge": "42", "planning_control_ros22_min_clear": "-0.793", "planning_control_ros22_mission_status": "124", "planning_control_ros22_pass": "0", "planning_control_ros22_progress": "148.126", "planning_control_ros22_rev": "233", "planning_control_ros22_stuck": "43", "planning_control_ros22_time": "196.53", "planning_control_stuck": "8", "planning_control_time": "278.33"}, "retry_rule": "Run Tier 2 repeats at timeout 360 before keep/discard. Keep only if repeat reliability is acceptable or dual-lane progress improves without new safety failures.", "robot_branch": "auto_main", "robot_commit": "82dffc050e6d", "sim_commit": "60ea0b06e2e2", "status": "needs_rerun", "tier": 1, "time": "2026-06-01T08:08:42"}
{"base_branch": "hailmary_deploy", "branch_scope": "auto_main", "change_summary": "on top of full Smac lattice plus 1m arrival and critic balance, publish /local_mirror_layer/clear at each GPS waypoint and set line/local-mirror clear_radius to 0.85m", "conclusion": "Discarded after Tier 2: the footprint-sized clear produced one clean Gazebo Tier1 pass and improved one ROS22 final-return attempt, but repeats failed 0/2 clean in both lanes and regressed distance means. It is not stable enough to keep or commit.", "courses": ["blender_competition_course"], "diff_path": "/Users/cole/code/git/autonav_sim/igvc_competition_sim/autoresearch/results/patches/20260601_082305_add-a-footprint-sized-local-mirror-and-line.patch", "diff_sha256": "7948c8e8e6ff5d01ecd32f1699af5643c2918a2120ad05ff2372a1840b5c96e9", "diff_stat": ".../gps_waypoint_handler/gps_handler_node.py       |  8 ++-\n isaac_ros-dev/src/slam/config/nav2_paramsv2.yaml   | 63 +++++++++++-----------\n 2 files changed, 38 insertions(+), 33 deletions(-)", "files_changed": ["isaac_ros-dev/src/gps_waypoint_handler/gps_waypoint_handler/gps_handler_node.py", "isaac_ros-dev/src/slam/config/nav2_paramsv2.yaml"], "hypothesis": "Add a footprint-sized local mirror and line memory clear at each GPS waypoint handoff on the prior full-route stack to remove lethal-start stalls on later legs", "id": "20260601_082305_add-a-footprint-sized-local-mirror-and-line", "normalized_hypothesis": "add a footprint sized local mirror and line memory clear at each gps waypoint handoff on the prior full route stack to remove lethal start stalls on later legs", "notes": "Tier1 had one clean planning_control pass but planning_control_ros22 timed out final return. Tier2 timeout 360 repeats: planning_control /home/cole.guest/autonav_split_ws/src/autonav_sim/igvc_competition_sim/autoresearch/results/runs/blender_competition_course_20260601_080901_run{1,2}; planning_control_ros22 /home/cole.guest/autonav_jetson_sim_ws/src/autonav_sim/igvc_competition_sim/autoresearch/results/runs/blender_competition_course_20260601_080900_run{1,2}.", "result": {"planning_control_ros22_run1_ge": "71", "planning_control_ros22_run1_min_clear": "-0.678", "planning_control_ros22_run1_stuck": "72", "planning_control_ros22_run2_ge": "0", "planning_control_ros22_run2_min_clear": "-0.729", "planning_control_ros22_run2_stuck": "0", "planning_control_ros22_tier2_distance": "71.63", "planning_control_ros22_tier2_pass": "0", "planning_control_ros22_tier2_progress": "111.63", "planning_control_ros22_tier2_runs": "2", "planning_control_run1_ge": "134", "planning_control_run1_min_clear": "-0.527", "planning_control_run1_stuck": "137", "planning_control_run2_ge": "8", "planning_control_run2_min_clear": "-0.805", "planning_control_run2_stuck": "55", "planning_control_tier2_distance": "56.724", "planning_control_tier2_pass": "0", "planning_control_tier2_progress": "96.724", "planning_control_tier2_runs": "2"}, "retry_rule": "Do not keep full-route+0.85m waypoint clear. Future memory-clear work would need a different trigger/radius or independent evidence; this stack should remain reverted.", "robot_branch": "auto_main", "robot_commit": "82dffc050e6d", "sim_commit": "60ea0b06e2e2", "status": "discarded", "tier": 2, "time": "2026-06-01T08:23:05"}
{"base_branch": "hailmary_deploy", "branch_scope": "auto_main", "change_summary": "guard gps_handler_node goal_handle terminal transitions with is_active/try-except so duplicate terminal races do not throw execute_callback exceptions", "conclusion": "Kept as a low-risk robustness fix: it does not solve the planner timeout, but it removes the gps_handler fatal action-state exception on timeout/abort paths, directly addressing the waypoint abort/state-race symptom without changing planner safety or scorer behavior.", "courses": ["blender_competition_course"], "diff_path": "/Users/cole/code/git/autonav_sim/igvc_competition_sim/autoresearch/results/patches/20260601_083416_make-gps-waypoint-termination-idempotent-so.patch", "diff_sha256": "99567f6036937c9ca89dfaf4805d42fb7264e0255cc428977166a563baa121ab", "diff_stat": ".../gps_waypoint_handler/gps_handler_node.py       | 25 +++++++++++++++-------\n 1 file changed, 17 insertions(+), 8 deletions(-)", "files_changed": ["isaac_ros-dev/src/gps_waypoint_handler/gps_waypoint_handler/gps_handler_node.py"], "hypothesis": "Make gps waypoint termination idempotent so timeout or Nav2 abort paths do not raise invalid action-state transitions", "id": "20260601_083416_make-gps-waypoint-termination-idempotent-so", "normalized_hypothesis": "make gps waypoint termination idempotent so timeout or nav2 abort paths do not raise invalid action state transitions", "notes": "valid direct evaluate.py runs with timeout 360: planning_control /home/cole.guest/autonav_split_ws/src/autonav_sim/igvc_competition_sim/autoresearch/results/runs/blender_competition_course_20260601_082634_run1; planning_control_ros22 /home/cole.guest/autonav_jetson_sim_ws/src/autonav_sim/igvc_competition_sim/autoresearch/results/runs/blender_competition_course_20260601_082634_run1. Grep found no invalid transition/execute_callback exception/RCLError in launch logs; both lanes logged only caught goal terminal transition skipped after state race during shutdown.", "result": {"planning_control_ang_var": "0.20055", "planning_control_distance": "28.895", "planning_control_ge": "68", "planning_control_invalid_transition": "0", "planning_control_min_clear": "-0.333", "planning_control_mission_status": "124", "planning_control_progress": "68.895", "planning_control_rev": "77", "planning_control_ros22_ang_var": "0.24008", "planning_control_ros22_distance": "28.185", "planning_control_ros22_ge": "66", "planning_control_ros22_invalid_transition": "0", "planning_control_ros22_min_clear": "-0.465", "planning_control_ros22_mission_status": "124", "planning_control_ros22_progress": "68.185", "planning_control_ros22_rev": "76", "planning_control_ros22_stuck": "124", "planning_control_stuck": "123"}, "retry_rule": "Use this as the new auto_main base for future candidates; continue targeting planner start-in-lethal and controller rocking separately.", "robot_branch": "auto_main", "robot_commit": "82dffc050e6d", "sim_commit": "a0de30dac190", "status": "kept", "tier": 1, "time": "2026-06-01T08:34:16"}
{"base_branch": "hailmary_deploy", "branch_scope": "auto_main", "change_summary": "on top of full Smac lattice plus 1m arrival and critic balance, add global_costmap/clear_around_global_costmap reset_distance 0.85 to PlanRecovery", "conclusion": "Discarded: small global clear allowed both lanes to reach final return but did not complete; progress was below the best route-stack/waypoint-clear single run and still had poor clearance and high angular reversals.", "courses": ["blender_competition_course"], "diff_path": "/Users/cole/code/git/autonav_sim/igvc_competition_sim/autoresearch/results/patches/20260601_084355_add-a-small-global-costmap-clear-during-plan.patch", "diff_sha256": "2481c30633cb6ab9c018394f17bad8e404a0d9010a91d43b236bbdb15c25d913", "diff_stat": "isaac_ros-dev/src/slam/behavior_trees/bt_nav.xml |  3 ++\n isaac_ros-dev/src/slam/config/nav2_paramsv2.yaml | 58 +++++++++++-------------\n 2 files changed, 29 insertions(+), 32 deletions(-)", "files_changed": ["isaac_ros-dev/src/slam/config/nav2_paramsv2.yaml", "isaac_ros-dev/src/slam/behavior_trees/bt_nav.xml"], "hypothesis": "Add a small global costmap clear during PlanRecovery on the prior full-route stack so Smac can recover when the robot start cell is lethal", "id": "20260601_084355_add-a-small-global-costmap-clear-during-plan", "normalized_hypothesis": "add a small global costmap clear during planrecovery on the prior full route stack so smac can recover when the robot start cell is lethal", "notes": "valid direct evaluate.py runs with timeout 360: planning_control /home/cole.guest/autonav_split_ws/src/autonav_sim/igvc_competition_sim/autoresearch/results/runs/blender_competition_course_20260601_083625_run1; planning_control_ros22 /home/cole.guest/autonav_jetson_sim_ws/src/autonav_sim/igvc_competition_sim/autoresearch/results/runs/blender_competition_course_20260601_083625_run1", "result": {"planning_control_ang_var": "0.3339", "planning_control_distance": "99.456", "planning_control_ge": "55", "planning_control_min_clear": "-0.773", "planning_control_mission_status": "124", "planning_control_progress": "139.456", "planning_control_rev": "230", "planning_control_ros22_ang_var": "0.33068", "planning_control_ros22_distance": "103.209", "planning_control_ros22_ge": "54", "planning_control_ros22_min_clear": "-0.805", "planning_control_ros22_mission_status": "124", "planning_control_ros22_progress": "143.209", "planning_control_ros22_rev": "228", "planning_control_ros22_stuck": "54", "planning_control_ros22_time": "176.76", "planning_control_stuck": "55", "planning_control_time": "175.12"}, "retry_rule": "Do not keep full-route+PlanRecovery global clear 0.85. Continue with planner geometry changes rather than adding more clear actions to this stack.", "robot_branch": "auto_main", "robot_commit": "8604d8ac8784", "sim_commit": "447b640ce75b", "status": "discarded", "tier": 1, "time": "2026-06-01T08:43:55"}
{"base_branch": "hailmary_deploy", "branch_scope": "auto_main", "change_summary": "add append_far_segment parameter to LocalThenStraightPlanner and set GridBased.append_far_segment=false", "conclusion": "Discarded: removing the far straight tail did not let the rolling near-field planner advance reliably. planning_control reached only 28.484m and planning_control_ros22 regressed to 15.104m, both mission_status=124.", "courses": ["blender_competition_course"], "diff_path": "/Users/cole/code/git/autonav_sim/igvc_competition_sim/autoresearch/results/patches/20260601_085312_disable-the-localthenstraight-far-tail-appen.patch", "diff_sha256": "f1486ce5f31ffabbe3929715bbfc31f9b7b990e0c2313f3e89e1d13f119900d2", "diff_stat": ".../autonav_hybrid_planner/local_then_straight_planner.hpp |  1 +\n .../src/local_then_straight_planner.cpp                    | 14 ++++++++++++--\n isaac_ros-dev/src/slam/config/nav2_paramsv2.yaml           |  1 +\n 3 files changed, 14 insertions(+), 2 deletions(-)", "files_changed": ["isaac_ros-dev/src/autonav_hybrid_planner/include/autonav_hybrid_planner/local_then_straight_planner.hpp", "isaac_ros-dev/src/autonav_hybrid_planner/src/local_then_straight_planner.cpp", "isaac_ros-dev/src/slam/config/nav2_paramsv2.yaml"], "hypothesis": "Disable the LocalThenStraight far-tail append so GPS goals are followed as rolling near-field lattice segments instead of an unchecked straight tail", "id": "20260601_085312_disable-the-localthenstraight-far-tail-appen", "normalized_hypothesis": "disable the localthenstraight far tail append so gps goals are followed as rolling near field lattice segments instead of an unchecked straight tail", "notes": "valid direct evaluate.py runs with timeout 360: planning_control /home/cole.guest/autonav_split_ws/src/autonav_sim/igvc_competition_sim/autoresearch/results/runs/blender_competition_course_20260601_084555_run1; planning_control_ros22 /home/cole.guest/autonav_jetson_sim_ws/src/autonav_sim/igvc_competition_sim/autoresearch/results/runs/blender_competition_course_20260601_084555_run1", "result": {"planning_control_ang_var": "0.26182", "planning_control_distance": "28.484", "planning_control_ge": "27", "planning_control_min_clear": "-0.343", "planning_control_mission_status": "124", "planning_control_progress": "68.484", "planning_control_rev": "73", "planning_control_ros22_ang_var": "0.24237", "planning_control_ros22_distance": "15.104", "planning_control_ros22_ge": "57", "planning_control_ros22_min_clear": "-0.214", "planning_control_ros22_mission_status": "124", "planning_control_ros22_progress": "55.104", "planning_control_ros22_rev": "35", "planning_control_ros22_stuck": "59", "planning_control_stuck": "33"}, "retry_rule": "Do not keep append_far_segment=false. If revisiting LocalThenStraight, use a different far-tail shape or path weighting, not a complete tail removal.", "robot_branch": "auto_main", "robot_commit": "8604d8ac8784", "sim_commit": "447b640ce75b", "status": "discarded", "tier": 1, "time": "2026-06-01T08:53:12"}
{"base_branch": "hailmary_deploy", "branch_scope": "auto_main", "change_summary": "no new code changes; reconstructed prior full-route plus 0.85m waypoint local mirror/line clear candidate and reran Blender with timeout 360 on both VMs", "conclusion": "The earlier clean result is not valid under ground_truth_odom_swept_footprint_v3. Gazebo completed mission_status=0 but failed: first_failure=tape_crossing:Line.002_0253, tape_crossing=182, obstacle_contact=16, all_waypoints_reached=false, waypoints=4/5. ROS22 failed: mission_status=124, first_failure=tape_crossing:Line.002_0235, tape_crossing=57, obstacle_contact=4, blocking_traffic=2, waypoints=3/5.", "courses": ["blender_competition_course"], "files_changed": [], "hypothesis": "Rerun the previous one-off clean full-route waypoint-clear candidate under scoring v3 dual sim", "id": "20260601_122053_rerun-the-previous-one-off-clean-full-route", "normalized_hypothesis": "rerun the previous one off clean full route waypoint clear candidate under scoring v3 dual sim", "notes": "Runs: planning_control /home/cole.guest/autonav_split_ws/src/autonav_sim/igvc_competition_sim/autoresearch/results/runs/blender_competition_course_20260601_120222_run1; planning_control_ros22 /home/cole.guest/autonav_jetson_sim_ws/src/autonav_sim/igvc_competition_sim/autoresearch/results/runs/blender_competition_course_20260601_120221_run1. Both used timeout 360, oracle ground-truth lines/PCA, retained bags, score_schema_version=3, odom_source=primary.", "result": {}, "retry_rule": "Do not retry the prior full-route plus 0.85m waypoint-clear stack as a clean candidate; future route/clearance work must pass scorer v3 in both lanes.", "robot_branch": "auto_main", "robot_commit": "82dffc050e6d+prior-best-scratch", "sim_commit": "67506f1", "status": "discarded", "tier": 1, "time": "2026-06-01T12:20:53"}
