{"base_branch": "hailmary_deploy", "branch_scope": "auto_main", "change_summary": "no robot changes; baseline on validated Blender course", "conclusion": "Baseline stopped early after nine repeated waypoint-1 mission aborts: direct NavigateToPose returned ABORTED within about 0.5s; progress 0.49-1.25m; no scorer line/obstacle/contact failure.", "courses": ["blender_competition_course"], "files_changed": [], "hypothesis": "auto_main Blender course baseline before tuning", "id": "20260601_041216_auto-main-blender-course-baseline-before-tun", "normalized_hypothesis": "auto main blender course baseline before tuning", "notes": "timebox_dir=results/timebox/20260601_040501; stopped early by supervisor to preserve 5h budget after repeated identical aborts", "result": {"any_gate_pass": false, "attempt_count": 9, "best_distance_mean": 1.254, "best_progress_fitness": 41.254, "timebox_summary": "results/timebox/20260601_040501/summary.json"}, "retry_rule": "Use as baseline evidence; next candidate should target initial waypoint NavigateToPose handoff, not line/contact safety.", "robot_branch": "auto_main", "robot_commit": "6fd4e2b3a", "sim_commit": "380abd69d245", "status": "baseline", "tier": 1, "time": "2026-06-01T04:12:16"}
{"base_branch": "hailmary_deploy", "branch_scope": "auto_main", "change_summary": "route first waypoint topic publish through /goal_update while direct NavigateToPose action starts the leg", "conclusion": "Interrupted Tier 1 screen removed the baseline immediate waypoint-1 abort: Nav2 no longer logged same-millisecond goal preemption and distance improved from 0.49-1.25m baseline to 14.577m and 28.558m. Both completed attempts still timed out with mission_status=124 before mission completion; course_monitor reported no line crossing or obstacle contact. Logs show repeated GradientEscape plus DriveOnHeading collision-ahead/backup-failed churn after progress, so this is promising handoff evidence but not a clean keep.", "courses": ["blender_competition_course"], "files_changed": ["isaac_ros-dev/src/gps_waypoint_handler/gps_waypoint_handler/gps_handler_node.py"], "hypothesis": "Avoid self-preempting first waypoint by using only the direct NavigateToPose action for the initial handoff instead of also publishing /goal_pose", "id": "20260601_043458_avoid-self-preempting-first-waypoint-by-usin", "normalized_hypothesis": "avoid self preempting first waypoint by using only the direct navigatetopose action for the initial handoff instead of also publishing goal pose", "notes": "timebox_dir=results/timebox/20260601_041335; attempts: 14.577m and 28.558m, both mission_status=124; run stopped early by user request; patch was uncommitted and will be reverted for handoff cleanliness", "result": {"any_gate_pass": false, "attempt_count": 2, "best_distance_mean": 28.558, "best_progress_fitness": 68.558, "timebox_summary": "results/timebox/20260601_041335/summary.json"}, "retry_rule": "Re-apply/retest direct-action-only initial handoff before or with a recovery-churn hypothesis; do not count it as clean or committed. Preserve scorer/course geometry.", "robot_branch": "auto_main", "robot_commit": "6fd4e2b3a", "sim_commit": "380abd69d245", "status": "needs_rerun", "tier": 1, "time": "2026-06-01T04:34:58"}
{"base_branch": "hailmary_deploy", "branch_scope": "auto_main", "change_summary": "route first waypoint topic publish through /goal_update while direct NavigateToPose action starts the leg", "conclusion": "Kept as pre-clean progress fix: baseline aborted around waypoint 1 at about 1.254 m, while current dual confirmations reached 15.027 m on planning_control and 33.988 m on planning_control_ros22 with no scorer line or obstacle failures; remaining dominant failure is mission timeout with GradientEscape/stuck churn.", "courses": ["blender_competition_course"], "diff_path": "/Users/cole/code/git/autonav_sim/igvc_competition_sim/autoresearch/results/patches/20260601_052412_avoid-self-preempting-first-waypoint-by-usin.patch", "diff_sha256": "70ced0e50a4578e10d7e3c9fc149b89ded2f16338d7c8dc8478ee384e0b6db2b", "diff_stat": ".../gps_waypoint_handler/gps_handler_node.py         | 20 ++++++++++----------\n 1 file changed, 10 insertions(+), 10 deletions(-)", "files_changed": ["isaac_ros-dev/src/gps_waypoint_handler/gps_waypoint_handler/gps_handler_node.py"], "hypothesis": "Avoid self-preempting first waypoint by using only the direct NavigateToPose action for the initial handoff instead of also publishing /goal_pose", "id": "20260601_052412_avoid-self-preempting-first-waypoint-by-usin", "normalized_hypothesis": "avoid self preempting first waypoint by using only the direct navigatetopose action for the initial handoff instead of also publishing goal pose", "notes": "dual sim oracle Blender only; remote summaries: planning_control /home/cole.guest/autonav_split_ws/src/autonav_sim/igvc_competition_sim/autoresearch/results/timebox/20260601_051718/summary.json; planning_control_ros22 /home/cole.guest/autonav_jetson_sim_ws/src/autonav_sim/igvc_competition_sim/autoresearch/results/timebox/20260601_051718/summary.json; sim harness at ecc2791; robot candidate py_compile passed and built in both VMs before evaluation", "result": {"distance": "33.988", "failed": "false", "finish_reached": "true", "ge": "27", "mission_status": "124", "progress": "73.988", "stuck": "31"}, "retry_rule": "Next candidate should target recovery/stuck churn and action completion timeout after the handoff fix.", "robot_branch": "auto_main", "robot_commit": "82dffc05", "sim_commit": "ecc279109b78", "status": "kept", "tier": 1, "time": "2026-06-01T05:24:12"}
{"base_branch": "hailmary_deploy", "branch_scope": "auto_main", "change_summary": "raise GridBased.near_lattice cost_penalty from 4.0 to 6.0", "conclusion": "Discarded: dual Tier 1 did not materially improve the recovery/start-in-lethal failure. planning_control reached 18.661 m but recovery churn and clearance worsened versus the current handoff baseline (ge 107/stuck 106/min_clear -0.482). planning_control_ros22 reached 33.089 m, slightly below the current 33.988 m confirmation, with ge 30/stuck 29. No scorer contact failures, but no reliability gain and Gazebo safety margin worsened.", "courses": ["blender_competition_course"], "diff_path": "/Users/cole/code/git/autonav_sim/igvc_competition_sim/autoresearch/results/patches/20260601_053546_increase-near-field-smac-cost-penalty-so-loc.patch", "diff_sha256": "26d79bc0affe537228a172b54e73705b08e29f1e158a049abca94c83bf243f6a", "diff_stat": "isaac_ros-dev/src/slam/config/nav2_paramsv2.yaml | 2 +-\n 1 file changed, 1 insertion(+), 1 deletion(-)", "files_changed": ["isaac_ros-dev/src/slam/config/nav2_paramsv2.yaml"], "hypothesis": "Increase near-field Smac cost penalty so local plans prefer clearance and avoid line-hugging start-in-lethal recovery churn", "id": "20260601_053546_increase-near-field-smac-cost-penalty-so-loc", "normalized_hypothesis": "increase near field smac cost penalty so local plans prefer clearance and avoid line hugging start in lethal recovery churn", "notes": "remote summaries: planning_control /home/cole.guest/autonav_split_ws/src/autonav_sim/igvc_competition_sim/autoresearch/results/timebox/20260601_052920/summary.json; planning_control_ros22 /home/cole.guest/autonav_jetson_sim_ws/src/autonav_sim/igvc_competition_sim/autoresearch/results/timebox/20260601_052920/summary.json", "result": {"distance": "33.089", "ge": "30", "min_clear": "-0.331", "mission_status": "124", "progress": "73.089", "stuck": "29"}, "retry_rule": "Do not retry cost_penalty 6.0 alone; target recovery dispatch or controller churn instead.", "robot_branch": "auto_main", "robot_commit": "82dffc05", "sim_commit": "3410f8a", "status": "discarded", "tier": 1, "time": "2026-06-01T05:35:46"}
{"base_branch": "hailmary_deploy", "branch_scope": "auto_main", "change_summary": "wrap FollowPath with IsForwardBlocked gate and breadcrumb_reverse fallback using angle_threshold 2.20", "conclusion": "Discarded: the branch changed the symptom but regressed progress. planning_control dropped to 14.46 m with ge 61/stuck 112. planning_control_ros22 dropped to 16.859 m; GradientEscape fell to 0 and stuck to 1, but breadcrumb_reverse fired 110 times, indicating over-reversal/false-positive dispatch. No scorer contact failures, but reliability and progress worsened versus the current handoff baseline.", "courses": ["blender_competition_course"], "diff_path": "/Users/cole/code/git/autonav_sim/igvc_competition_sim/autoresearch/results/patches/20260601_054355_restore-forward-blocked-breadcrumb-reverse-d.patch", "diff_sha256": "20e536657d32cb05420c18bc9a11dddc1ac7ceb8a9f085dc3fea94dd22ee6a25", "diff_stat": "isaac_ros-dev/src/slam/behavior_trees/bt_nav.xml | 53 ++++++++++++++----------\n 1 file changed, 32 insertions(+), 21 deletions(-)", "files_changed": ["isaac_ros-dev/src/slam/behavior_trees/bt_nav.xml"], "hypothesis": "Restore forward-blocked breadcrumb reverse dispatch before generic recovery to reduce GradientEscape start-in-lethal churn", "id": "20260601_054355_restore-forward-blocked-breadcrumb-reverse-d", "normalized_hypothesis": "restore forward blocked breadcrumb reverse dispatch before generic recovery to reduce gradientescape start in lethal churn", "notes": "remote summaries: planning_control /home/cole.guest/autonav_split_ws/src/autonav_sim/igvc_competition_sim/autoresearch/results/timebox/20260601_053747/summary.json; planning_control_ros22 /home/cole.guest/autonav_jetson_sim_ws/src/autonav_sim/igvc_competition_sim/autoresearch/results/timebox/20260601_053746/summary.json", "result": {"bc": "110", "distance": "16.859", "ge": "0", "min_clear": "-0.314", "mission_status": "124", "progress": "56.859", "stuck": "1"}, "retry_rule": "Do not retry this broad FollowOrReverse restore with angle_threshold 2.20. A future breadcrumb test would need stricter preconditions/caps, not tonight's simple restore.", "robot_branch": "auto_main", "robot_commit": "82dffc05", "sim_commit": "10a0706", "status": "discarded", "tier": 1, "time": "2026-06-01T05:43:55"}
{"base_branch": "hailmary_deploy", "branch_scope": "auto_main", "change_summary": "set controller_server FollowPath MPPI temperature from 0.3 to 0.6", "conclusion": "Discarded: controller smoothing signal was mixed and safety/progress regressed on ROS22. planning_control improved to 28.947 m with ge 52/stuck 93 but min_clear worsened to -0.488. planning_control_ros22 fell from the current 33.988 m confirmation to 28.109 m with ge 57/stuck 95 and min_clear -0.539. Both still timed out mission_status=124.", "courses": ["blender_competition_course"], "diff_path": "/Users/cole/code/git/autonav_sim/igvc_competition_sim/autoresearch/results/patches/20260601_055840_raise-mppi-temperature-from-0-3-to-0-6-to-re.patch", "diff_sha256": "3b49eeac94cfcdee070e4f6222473eb7cd039acdfe046f82ad3a188a79bb7e0f", "diff_stat": "isaac_ros-dev/src/slam/config/nav2_paramsv2.yaml | 2 +-\n 1 file changed, 1 insertion(+), 1 deletion(-)", "files_changed": ["isaac_ros-dev/src/slam/config/nav2_paramsv2.yaml"], "hypothesis": "Raise MPPI temperature from 0.3 to 0.6 to reduce controller rocking without narrowing angular authority", "id": "20260601_055840_raise-mppi-temperature-from-0-3-to-0-6-to-re", "normalized_hypothesis": "raise mppi temperature from 0 3 to 0 6 to reduce controller rocking without narrowing angular authority", "notes": "The earlier 20260601_054513/054514 orphaned run_one artifacts were invalid and ignored because final_score.txt/mission_status.txt were missing after run_timebox KeyboardInterrupt. Valid evidence is direct evaluate.py runs under results/runs/blender_competition_course_20260601_055230_run1 in both VMs.", "result": {"distance": "28.109", "ge": "57", "min_clear": "-0.539", "mission_status": "124", "progress": "68.109", "rev": "56", "stuck": "95", "var": "0.1612"}, "retry_rule": "Do not keep temperature 0.6 alone on auto_main Blender; revisit controller smoothing only after mission completion/clearance failure is addressed.", "robot_branch": "auto_main", "robot_commit": "82dffc05", "sim_commit": "8365652", "status": "discarded", "tier": 1, "time": "2026-06-01T05:58:40"}
{"base_branch": "hailmary_deploy", "branch_scope": "auto_main", "change_summary": "replace LocalThenStraightPlanner with full SmacPlannerLattice in nav2_paramsv2 and raise planning budget to 1M iterations / 2.0s", "conclusion": "Discarded as unsafe partial improvement: dual Blender Tier 1 moved the failure from waypoint-1 timeout to later waypoint aborts and reached 43.944m on planning_control_ros22 and 55.318m on planning_control, but logs then showed repeated GridBased starting-point-in-lethal-space failures and min_course_clear worsened to -0.484/-0.608. Not safe to keep without a clearance/start-in-lethal fix.", "courses": ["blender_competition_course"], "diff_path": "results/patches/20260601_062134_use-full-smac-lattice-planning-for-far-gps-g.patch", "diff_sha256": "3f1315b5b4e24945afe7ea57fd3e25777aff3ece3d740758b89d39b87cb1be67", "diff_stat": "isaac_ros-dev/src/slam/config/nav2_paramsv2.yaml | 46 ++++++++++--------------\n 1 file changed, 19 insertions(+), 27 deletions(-)", "files_changed": ["isaac_ros-dev/src/slam/config/nav2_paramsv2.yaml"], "hypothesis": "Use full Smac lattice planning for far GPS goals instead of the LocalThenStraight shortcut so the planner cannot append unchecked far segments and walk away from the waypoint", "id": "20260601_062134_use-full-smac-lattice-planning-for-far-gps-g", "normalized_hypothesis": "use full smac lattice planning for far gps goals instead of the localthenstraight shortcut so the planner cannot append unchecked far segments and walk away from the waypoint", "notes": "valid direct evaluate.py runs: planning_control /home/cole.guest/autonav_split_ws/src/autonav_sim/igvc_competition_sim/autoresearch/results/runs/blender_competition_course_20260601_061726_run1; planning_control_ros22 /home/cole.guest/autonav_jetson_sim_ws/src/autonav_sim/igvc_competition_sim/autoresearch/results/runs/blender_competition_course_20260601_061726_run1", "result": {"planning_control_distance": "55.318", "planning_control_min_clear": "-0.608", "planning_control_mission_status": "1", "planning_control_progress": "95.318", "planning_control_ros22_distance": "43.944", "planning_control_ros22_min_clear": "-0.484", "planning_control_ros22_mission_status": "1", "planning_control_ros22_progress": "83.944"}, "retry_rule": "Do not keep full SmacPlannerLattice 2.0s alone; use the evidence to target hybrid far-tail geometry or start-in-lethal clearance.", "robot_branch": "auto_main", "robot_commit": "82dffc05", "sim_commit": "d37a65d", "status": "discarded", "tier": 1, "time": "2026-06-01T06:21:34"}
{"base_branch": "hailmary_deploy", "branch_scope": "auto_main", "change_summary": "set LocalThenStraight local_horizon_m 2.75->6.0, close_goal_distance_m 3.0->6.25, far_collision_check false->true, near_lattice budget 50k/0.20s->150k/0.35s", "conclusion": "Discarded: dual Blender Tier 1 still failed and worsened safety. planning_control timed out on waypoint 1 at 42.899m with ge=86/stuck=85/min_clear=-0.455. planning_control_ros22 reached waypoint 1 then aborted waypoint 2 at 65.249m, but min_clear degraded to -0.760. Logs still show GridBased.near_lattice starting-point-in-lethal-space churn.", "courses": ["blender_competition_course"], "diff_path": "results/patches/20260601_062841_widen-the-localthenstraight-near-field-latti.patch", "diff_sha256": "97b603feceada17a898c2b72c5f32934d26f1e51244a07ff8d594e9fd3496c5b", "diff_stat": "isaac_ros-dev/src/slam/config/nav2_paramsv2.yaml | 19 +++++++++----------\n 1 file changed, 9 insertions(+), 10 deletions(-)", "files_changed": ["isaac_ros-dev/src/slam/config/nav2_paramsv2.yaml"], "hypothesis": "Widen the LocalThenStraight near-field lattice horizon and enable far-tail collision checks so the hybrid planner cannot publish a short-horizon route that walks away from the GPS waypoint", "id": "20260601_062841_widen-the-localthenstraight-near-field-latti", "normalized_hypothesis": "widen the localthenstraight near field lattice horizon and enable far tail collision checks so the hybrid planner cannot publish a short horizon route that walks away from the gps waypoint", "notes": "valid direct evaluate.py runs: planning_control /home/cole.guest/autonav_split_ws/src/autonav_sim/igvc_competition_sim/autoresearch/results/runs/blender_competition_course_20260601_062234_run1; planning_control_ros22 /home/cole.guest/autonav_jetson_sim_ws/src/autonav_sim/igvc_competition_sim/autoresearch/results/runs/blender_competition_course_20260601_062234_run1", "result": {"planning_control_distance": "42.899", "planning_control_min_clear": "-0.455", "planning_control_mission_status": "124", "planning_control_progress": "82.899", "planning_control_ros22_distance": "65.249", "planning_control_ros22_min_clear": "-0.760", "planning_control_ros22_mission_status": "1", "planning_control_ros22_progress": "105.249"}, "retry_rule": "Do not retry horizon 6m + far_collision_check alone; the next planner test should remove the hybrid far-tail differently or add a separate safety/clearance fix after a route fix.", "robot_branch": "auto_main", "robot_commit": "82dffc05", "sim_commit": "d37a65d", "status": "discarded", "tier": 1, "time": "2026-06-01T06:28:41"}
{"base_branch": "hailmary_deploy", "branch_scope": "auto_main", "change_summary": "replace LocalThenStraightPlanner GridBased block with nav2_smac_planner/SmacPlanner2D full-route planner", "conclusion": "Discarded: dual Blender Tier 1 reached waypoint 1 but immediately aborted waypoint 2 in both lanes, and did not materially improve distance over the current kept handoff baseline. planning_control distance=31.937/min_clear=-0.484; planning_control_ros22 distance=31.909/min_clear=-0.497. Smac2D did reduce angular variance but was not reliable or safer.", "courses": ["blender_competition_course"], "diff_path": "results/patches/20260601_063226_use-full-route-smacplanner2d-for-blender-gps.patch", "diff_sha256": "9512531a4f2610bfde3d90431cdf74addf91b1a1bf94a692c17b16e843b5712a", "diff_stat": "isaac_ros-dev/src/slam/config/nav2_paramsv2.yaml | 39 ++++++++----------------\n 1 file changed, 12 insertions(+), 27 deletions(-)", "files_changed": ["isaac_ros-dev/src/slam/config/nav2_paramsv2.yaml"], "hypothesis": "Use full-route SmacPlanner2D for Blender GPS legs to remove the LocalThenStraight far-tail assumption without expensive full-route lattice orientation search", "id": "20260601_063226_use-full-route-smacplanner2d-for-blender-gps", "normalized_hypothesis": "use full route smacplanner2d for blender gps legs to remove the localthenstraight far tail assumption without expensive full route lattice orientation search", "notes": "valid direct evaluate.py runs: planning_control /home/cole.guest/autonav_split_ws/src/autonav_sim/igvc_competition_sim/autoresearch/results/runs/blender_competition_course_20260601_062931_run1; planning_control_ros22 /home/cole.guest/autonav_jetson_sim_ws/src/autonav_sim/igvc_competition_sim/autoresearch/results/runs/blender_competition_course_20260601_062930_run1", "result": {"planning_control_distance": "31.937", "planning_control_min_clear": "-0.484", "planning_control_mission_status": "1", "planning_control_progress": "71.937", "planning_control_ros22_distance": "31.909", "planning_control_ros22_min_clear": "-0.497", "planning_control_ros22_mission_status": "1", "planning_control_ros22_progress": "71.909"}, "retry_rule": "Do not retry SmacPlanner2D alone; if revisiting full-route planning, pair it with a concrete arrival/clearance hypothesis rather than treating the planner swap alone as sufficient.", "robot_branch": "auto_main", "robot_commit": "82dffc05", "sim_commit": "d37a65d", "status": "discarded", "tier": 1, "time": "2026-06-01T06:32:26"}
