{"base_branch": "hailmary_deploy", "branch_scope": "auto_main", "change_summary": "replace LocalThenStraightPlanner with full SmacPlannerLattice and set general_goal_checker.xy_goal_tolerance from 0.25 to 1.0", "conclusion": "Discarded as unstable/unsafe despite a strong single-lane signal: planning_control reached waypoints 1-4 and 87.578m before timing out on the final return, but min_clear degraded to -0.766 with ge=35/stuck=37. planning_control_ros22 regressed to 14.5m with mission_status=124/ge=94/stuck=108. Not reliable or safe enough to keep.", "courses": ["blender_competition_course"], "diff_path": "results/patches/20260601_063937_use-full-route-smac-lattice-with-nav2-xy-goa.patch", "diff_sha256": "969d9776b056d910fb4784eeae3f017912e2f6d49e1f30645c04f507d39cf808", "diff_stat": "isaac_ros-dev/src/slam/config/nav2_paramsv2.yaml | 51 +++++++++++-------------\n 1 file changed, 23 insertions(+), 28 deletions(-)", "files_changed": ["isaac_ros-dev/src/slam/config/nav2_paramsv2.yaml"], "hypothesis": "Use full-route Smac lattice with Nav2 xy goal tolerance aligned to the 1m GPS waypoint radius so the robot stops before overdriving into lethal waypoint cells", "id": "20260601_063937_use-full-route-smac-lattice-with-nav2-xy-goa", "normalized_hypothesis": "use full route smac lattice with nav2 xy goal tolerance aligned to the 1m gps waypoint radius so the robot stops before overdriving into lethal waypoint cells", "notes": "valid direct evaluate.py runs: planning_control /home/cole.guest/autonav_split_ws/src/autonav_sim/igvc_competition_sim/autoresearch/results/runs/blender_competition_course_20260601_063316_run1; planning_control_ros22 /home/cole.guest/autonav_jetson_sim_ws/src/autonav_sim/igvc_competition_sim/autoresearch/results/runs/blender_competition_course_20260601_063315_run1", "result": {"planning_control_distance": "87.578", "planning_control_min_clear": "-0.766", "planning_control_mission_status": "124", "planning_control_progress": "127.578", "planning_control_ros22_distance": "14.5", "planning_control_ros22_min_clear": "-0.492", "planning_control_ros22_mission_status": "124", "planning_control_ros22_progress": "54.5"}, "retry_rule": "Do not keep full Smac lattice + 1m goal tolerance alone; if continuing this line, add an explicit clearance/controller-cost hypothesis and require dual-lane improvement.", "robot_branch": "auto_main", "robot_commit": "82dffc05", "sim_commit": "d37a65d", "status": "discarded", "tier": 1, "time": "2026-06-01T06:39:37"}
{"base_branch": "hailmary_deploy", "branch_scope": "auto_main", "change_summary": "on top of full Smac lattice plus 1m Nav2 goal tolerance, raise MPPI CostCritic cost_weight from 1.6 to 3.2", "conclusion": "Discarded: the stronger CostCritic was inconsistent and did not make the route/arrival candidate safe. planning_control reached waypoints 1-4 but timed out at 69.042m with min_clear=-0.842, worse than before. planning_control_ros22 again regressed to 14.428m, though its min_clear improved to -0.306. Dual reliability did not improve.", "courses": ["blender_competition_course"], "diff_path": "results/patches/20260601_064641_increase-mppi-costcritic-weight-on-the-full.patch", "diff_sha256": "36b6ace01df36b74809abbdb06e6aa38b9e62719b618e72d10762a6f885ec8f9", "diff_stat": "isaac_ros-dev/src/slam/config/nav2_paramsv2.yaml | 53 +++++++++++-------------\n 1 file changed, 24 insertions(+), 29 deletions(-)", "files_changed": ["isaac_ros-dev/src/slam/config/nav2_paramsv2.yaml"], "hypothesis": "Increase MPPI CostCritic weight on the full-route lattice plus 1m arrival candidate to avoid line-hugging and lethal-start churn", "id": "20260601_064641_increase-mppi-costcritic-weight-on-the-full", "normalized_hypothesis": "increase mppi costcritic weight on the full route lattice plus 1m arrival candidate to avoid line hugging and lethal start churn", "notes": "valid direct evaluate.py runs: planning_control /home/cole.guest/autonav_split_ws/src/autonav_sim/igvc_competition_sim/autoresearch/results/runs/blender_competition_course_20260601_064018_run1; planning_control_ros22 /home/cole.guest/autonav_jetson_sim_ws/src/autonav_sim/igvc_competition_sim/autoresearch/results/runs/blender_competition_course_20260601_064018_run1", "result": {"planning_control_distance": "69.042", "planning_control_min_clear": "-0.842", "planning_control_mission_status": "124", "planning_control_progress": "109.042", "planning_control_ros22_distance": "14.428", "planning_control_ros22_min_clear": "-0.306", "planning_control_ros22_mission_status": "124", "planning_control_ros22_progress": "54.428"}, "retry_rule": "Do not keep CostCritic 3.2 alone on this candidate; if continuing, test a relative critic-balance change that also reduces path adherence rather than only increasing cost weight.", "robot_branch": "auto_main", "robot_commit": "82dffc05", "sim_commit": "d37a65d", "status": "discarded", "tier": 1, "time": "2026-06-01T06:46:41"}
{"base_branch": "hailmary_deploy", "branch_scope": "auto_main", "change_summary": "on top of full Smac lattice plus 1m Nav2 goal tolerance and CostCritic 3.2, set PreferForward 10->6, PathAlign 12->8, PathFollow 14->8", "conclusion": "Discarded after Tier 2: the candidate produced the first full clean mission on planning_control in Tier 1 and reached waypoints 1-4 on both lanes, but repeats timed out on the final return. Tier2 planning_control: 0/2 clean, distance_mean=72.617, progress=112.617. Tier2 planning_control_ros22: 0/2 clean, distance_mean=111.46, progress=151.46. Clearance remained poor in several runs (-0.638 to -0.832), so this is promising route evidence but not a safe/reliable keep.", "courses": ["blender_competition_course"], "diff_path": "results/patches/20260601_070524_rebalance-mppi-critics-by-reducing-path-adhe.patch", "diff_sha256": "7b087c8352754449982602877b5eb7913fa2f26393e757444ca4a7ba842d6e9a", "diff_stat": "isaac_ros-dev/src/slam/config/nav2_paramsv2.yaml | 59 +++++++++++-------------\n 1 file changed, 27 insertions(+), 32 deletions(-)", "files_changed": ["isaac_ros-dev/src/slam/config/nav2_paramsv2.yaml"], "hypothesis": "Rebalance MPPI critics by reducing path-adherence weights while keeping stronger cost avoidance on the full-route lattice plus 1m arrival candidate", "id": "20260601_070524_rebalance-mppi-critics-by-reducing-path-adhe", "normalized_hypothesis": "rebalance mppi critics by reducing path adherence weights while keeping stronger cost avoidance on the full route lattice plus 1m arrival candidate", "notes": "Tier1: planning_control clean complete at /home/cole.guest/autonav_split_ws/src/autonav_sim/igvc_competition_sim/autoresearch/results/runs/blender_competition_course_20260601_064722_run1; planning_control_ros22 timed out final return at /home/cole.guest/autonav_jetson_sim_ws/src/autonav_sim/igvc_competition_sim/autoresearch/results/runs/blender_competition_course_20260601_064721_run1. Tier2: planning_control /home/cole.guest/autonav_split_ws/src/autonav_sim/igvc_competition_sim/autoresearch/results/runs/blender_competition_course_20260601_065338_run{1,2}; planning_control_ros22 /home/cole.guest/autonav_jetson_sim_ws/src/autonav_sim/igvc_competition_sim/autoresearch/results/runs/blender_competition_course_20260601_065337_run{1,2}.", "result": {"planning_control_ros22_tier2_distance": "111.46", "planning_control_ros22_tier2_pass": "0", "planning_control_ros22_tier2_progress": "151.46", "planning_control_tier1_pass": "1", "planning_control_tier2_distance": "72.617", "planning_control_tier2_pass": "0", "planning_control_tier2_progress": "112.617"}, "retry_rule": "Do not keep this full-route/goal-radius/critic-balance stack. Next work should target final-return completion and clearance, likely by analyzing final waypoint distance/route or using a less aggressive return strategy, not by further broad MPPI critic stacking.", "robot_branch": "auto_main", "robot_commit": "82dffc05", "sim_commit": "d37a65d", "status": "discarded", "tier": 2, "time": "2026-06-01T07:05:24"}
{"base_branch": "hailmary_deploy", "branch_scope": "auto_main", "change_summary": "on top of full Smac lattice plus critic-balance stack, set Nav2 xy_goal_tolerance and GPS waypoint success radius floor to 1.5m", "conclusion": "Discarded: increasing the arrival envelope to 1.5m on the prior full-route/critic-balance stack regressed both lanes versus the 1m Tier2 evidence. Both runs timed out on waypoint progress, with high GradientEscape/stuck counts and poor clearance; it did not solve the final-return/start-in-lethal issue.", "courses": ["blender_competition_course"], "diff_path": "/Users/cole/code/git/autonav_sim/igvc_competition_sim/autoresearch/results/patches/20260601_072244_use-a-1-5m-gps-waypoint-arrival-envelope-on.patch", "diff_sha256": "b422e5030052d57bd9c09ff409dc355af3d8097562d21f0200ba3ed5168e4a3c", "diff_stat": ".../gps_waypoint_handler/gps_handler_node.py       |  2 +\n isaac_ros-dev/src/slam/config/nav2_paramsv2.yaml   | 58 ++++++++++------------\n 2 files changed, 28 insertions(+), 32 deletions(-)", "files_changed": ["isaac_ros-dev/src/slam/config/nav2_paramsv2.yaml", "isaac_ros-dev/src/gps_waypoint_handler/gps_waypoint_handler/gps_handler_node.py"], "hypothesis": "Use a 1.5m GPS waypoint arrival envelope on the full-route critic-balance stack so waypoint handoff occurs before corner goals place the next start in lethal tape cost", "id": "20260601_072244_use-a-1-5m-gps-waypoint-arrival-envelope-on", "normalized_hypothesis": "use a 1 5m gps waypoint arrival envelope on the full route critic balance stack so waypoint handoff occurs before corner goals place the next start in lethal tape cost", "notes": "valid direct evaluate.py runs: planning_control /home/cole.guest/autonav_split_ws/src/autonav_sim/igvc_competition_sim/autoresearch/results/runs/blender_competition_course_20260601_071638_run1; planning_control_ros22 /home/cole.guest/autonav_jetson_sim_ws/src/autonav_sim/igvc_competition_sim/autoresearch/results/runs/blender_competition_course_20260601_071637_run1", "result": {"planning_control_distance": "41.459", "planning_control_ge": "82", "planning_control_min_clear": "-0.491", "planning_control_mission_status": "124", "planning_control_progress": "81.459", "planning_control_ros22_distance": "23.008", "planning_control_ros22_ge": "98", "planning_control_ros22_min_clear": "-0.690", "planning_control_ros22_mission_status": "124", "planning_control_ros22_progress": "63.008", "planning_control_ros22_stuck": "98", "planning_control_stuck": "81"}, "retry_rule": "Do not retry the 1.5m GPS/Nav2 arrival envelope on this stack. If using waypoint radius later, tie it to a different route/clearance fix and require dual-lane improvement.", "robot_branch": "auto_main", "robot_commit": "82dffc050e6d", "sim_commit": "d37a65d46a17", "status": "discarded", "tier": 1, "time": "2026-06-01T07:22:44"}
{"base_branch": "hailmary_deploy", "branch_scope": "auto_main", "change_summary": "set bt_navigator path_significantly_changed.force_update_period_s from 0.5 to 1.5", "conclusion": "Discarded: longer forced FollowPath refresh period did not reduce the dominant failure. Both lanes still timed out with mission_status=124; planning_control regressed to 19.886m and planning_control_ros22 reached only 28.676m. Angular/churn signals were mixed and progress was below the kept handoff baseline.", "courses": ["blender_competition_course"], "diff_path": "/Users/cole/code/git/autonav_sim/igvc_competition_sim/autoresearch/results/patches/20260601_073212_increase-pathsignificantlychanged-force-upda.patch", "diff_sha256": "277d106df171bd1a7ce62757b9fd2ecebca97a5318dc204ad9a6aca5954bb97e", "diff_stat": "isaac_ros-dev/src/slam/config/nav2_paramsv2.yaml | 2 +-\n 1 file changed, 1 insertion(+), 1 deletion(-)", "files_changed": ["isaac_ros-dev/src/slam/config/nav2_paramsv2.yaml"], "hypothesis": "Increase PathSignificantlyChanged force update period to reduce FollowPath action churn and controller rocking on refreshed GPS paths", "id": "20260601_073212_increase-pathsignificantlychanged-force-upda", "normalized_hypothesis": "increase pathsignificantlychanged force update period to reduce followpath action churn and controller rocking on refreshed gps paths", "notes": "valid direct evaluate.py runs: planning_control /home/cole.guest/autonav_split_ws/src/autonav_sim/igvc_competition_sim/autoresearch/results/runs/blender_competition_course_20260601_072602_run1; planning_control_ros22 /home/cole.guest/autonav_jetson_sim_ws/src/autonav_sim/igvc_competition_sim/autoresearch/results/runs/blender_competition_course_20260601_072601_run1", "result": {"planning_control_ang_var": "0.23842", "planning_control_distance": "19.886", "planning_control_ge": "105", "planning_control_min_clear": "-0.286", "planning_control_mission_status": "124", "planning_control_progress": "59.886", "planning_control_rev": "48", "planning_control_ros22_ang_var": "0.34231", "planning_control_ros22_distance": "28.676", "planning_control_ros22_ge": "28", "planning_control_ros22_min_clear": "-0.405", "planning_control_ros22_mission_status": "124", "planning_control_ros22_progress": "68.676", "planning_control_ros22_rev": "76", "planning_control_ros22_stuck": "98", "planning_control_stuck": "104"}, "retry_rule": "Do not keep or retry force_update_period_s=1.5 alone. If reducing goal/controller churn, prefer gating noisy gps_handler /goal_update publishes as a separate hypothesis.", "robot_branch": "auto_main", "robot_commit": "82dffc050e6d", "sim_commit": "ef294d6f9d6e", "status": "discarded", "tier": 1, "time": "2026-06-01T07:32:12"}
{"base_branch": "hailmary_deploy", "branch_scope": "auto_main", "change_summary": "replace LocalThenStraightPlanner with full Smac lattice, set Nav2 xy goal tolerance to 1.0, CostCritic to 3.2, PreferForward to 6, PathAlign to 8, PathFollow to 8; evaluate with timeout 360", "conclusion": "Discarded: increasing the timeout to 360s did not make the prior one-clean stack reliable. Both lanes reached waypoint 4 and failed final return with mission_status=124, no scorer contact violations, high angular reversal counts, and poor min_course_clear around -0.81/-0.85. The failure is not just the 300s cutoff.", "courses": ["blender_competition_course"], "diff_path": "/Users/cole/code/git/autonav_sim/igvc_competition_sim/autoresearch/results/patches/20260601_074033_re-run-the-prior-one-clean-full-route-lattic.patch", "diff_sha256": "2b0e49f7f8b794a309034b4e5482d2a1f608c98715f18b020d35ca47ff1c0307", "diff_stat": "isaac_ros-dev/src/slam/config/nav2_paramsv2.yaml | 58 +++++++++++-------------\n 1 file changed, 26 insertions(+), 32 deletions(-)", "files_changed": ["isaac_ros-dev/src/slam/config/nav2_paramsv2.yaml"], "hypothesis": "Re-run the prior one-clean full-route lattice plus 1m arrival and critic-balance stack with a 360 second timeout to test whether final-return failures are only timeout-limited", "id": "20260601_074033_re-run-the-prior-one-clean-full-route-lattic", "normalized_hypothesis": "re run the prior one clean full route lattice plus 1m arrival and critic balance stack with a 360 second timeout to test whether final return failures are only timeout limited", "notes": "User requested re-running the earlier one-clean stack with timeout 360 and using 360 for subsequent tests. Valid direct evaluate.py runs: planning_control /home/cole.guest/autonav_split_ws/src/autonav_sim/igvc_competition_sim/autoresearch/results/runs/blender_competition_course_20260601_073317_run1; planning_control_ros22 /home/cole.guest/autonav_jetson_sim_ws/src/autonav_sim/igvc_competition_sim/autoresearch/results/runs/blender_competition_course_20260601_073317_run1", "result": {"planning_control_ang_var": "0.20182", "planning_control_distance": "87.53", "planning_control_ge": "25", "planning_control_min_clear": "-0.808", "planning_control_mission_status": "124", "planning_control_progress": "127.53", "planning_control_rev": "192", "planning_control_ros22_ang_var": "0.29968", "planning_control_ros22_distance": "90.529", "planning_control_ros22_ge": "58", "planning_control_ros22_min_clear": "-0.849", "planning_control_ros22_mission_status": "124", "planning_control_ros22_progress": "130.529", "planning_control_ros22_rev": "218", "planning_control_ros22_stuck": "57", "planning_control_ros22_time": "203.05", "planning_control_stuck": "81", "planning_control_time": "282.56"}, "retry_rule": "Do not keep this full-route/1m/critic-balance stack solely by extending timeout. Future work should target final-return lethal-start/goal-update churn/clearance rather than the timeout limit.", "robot_branch": "auto_main", "robot_commit": "82dffc050e6d", "sim_commit": "ef294d6f9d6e", "status": "discarded", "tier": 1, "time": "2026-06-01T07:40:33"}
{"base_branch": "hailmary_deploy", "branch_scope": "auto_main", "change_summary": "after bootstrap, suppress /goal_update unless map goal moves 1.5m, heading changes 3deg, or 5s heartbeat elapses", "conclusion": "Discarded: post-bootstrap /goal_update threshold gating reduced update churn too aggressively and regressed first-leg progress. Both lanes still timed out before waypoint 1 with mission_status=124 and high stuck counts; distance was below the kept handoff baseline.", "courses": ["blender_competition_course"], "diff_path": "/Users/cole/code/git/autonav_sim/igvc_competition_sim/autoresearch/results/patches/20260601_075006_gate-post-bootstrap-gps-goal-update-publishe.patch", "diff_sha256": "12a5192ceaa10954904718b8c97b0f4ecc5d8648253a91988f96546409394e32", "diff_stat": ".../gps_waypoint_handler/gps_handler_node.py       | 35 ++++++++++------------\n 1 file changed, 15 insertions(+), 20 deletions(-)", "files_changed": ["isaac_ros-dev/src/gps_waypoint_handler/gps_waypoint_handler/gps_handler_node.py"], "hypothesis": "Gate post-bootstrap GPS goal_update publishes on map goal movement and heading thresholds to reduce controller rocking and stale goal churn", "id": "20260601_075006_gate-post-bootstrap-gps-goal-update-publishe", "normalized_hypothesis": "gate post bootstrap gps goal update publishes on map goal movement and heading thresholds to reduce controller rocking and stale goal churn", "notes": "valid direct evaluate.py runs with timeout 360: planning_control /home/cole.guest/autonav_split_ws/src/autonav_sim/igvc_competition_sim/autoresearch/results/runs/blender_competition_course_20260601_074258_run1; planning_control_ros22 /home/cole.guest/autonav_jetson_sim_ws/src/autonav_sim/igvc_competition_sim/autoresearch/results/runs/blender_competition_course_20260601_074258_run1", "result": {"planning_control_ang_var": "0.22154", "planning_control_distance": "18.304", "planning_control_ge": "63", "planning_control_min_clear": "-0.395", "planning_control_mission_status": "124", "planning_control_progress": "58.304", "planning_control_rev": "43", "planning_control_ros22_ang_var": "0.22357", "planning_control_ros22_distance": "29.374", "planning_control_ros22_ge": "44", "planning_control_ros22_min_clear": "-0.296", "planning_control_ros22_mission_status": "124", "planning_control_ros22_progress": "69.374", "planning_control_ros22_rev": "80", "planning_control_ros22_stuck": "110", "planning_control_stuck": "131"}, "retry_rule": "Do not keep this 1.5m/3deg/5s post-bootstrap gate. If revisiting gps_handler churn, use a narrower first-tick duplicate suppression rather than holding ordinary in-leg updates.", "robot_branch": "auto_main", "robot_commit": "82dffc050e6d", "sim_commit": "a2a512a00e69", "status": "discarded", "tier": 1, "time": "2026-06-01T07:50:06"}
